{
  "metadata": {
    "processing_timestamp": "2025-07-12T08:46:08.028770",
    "input_file_path": "/Users/petergiordano/Documents/GitHub/vsmonster/reference/episode_9_example.md",
    "total_processing_time_seconds": 0.007,
    "estimated_downstream_costs": {
      "elevenlabs_character_count": 0,
      "image_generation_count": 0,
      "sfx_count": 0,
      "music_cue_count": 0,
      "ambient_count": 0,
      "transition_count": 0
    },
    "detailed_cost_analysis": {
      "total_episode_cost": 0.0,
      "currency": "USD",
      "cost_breakdown": {
        "voice_generation": {
          "total_cost": 0.0,
          "cost_per_character": 0.0003,
          "total_characters": 0,
          "costs_by_speaker": {}
        },
        "image_generation": {
          "total_cost": 0.0,
          "cost_per_image": 0.05,
          "total_images": 0
        },
        "audio_processing": {
          "total_cost": 0.0,
          "sfx_cost": 0.0,
          "music_cost": 0.0,
          "ambient_cost": 0.0,
          "transition_cost": 0.0,
          "breakdown": {
            "sfx_count": 0,
            "music_count": 0,
            "ambient_count": 0,
            "transition_count": 0
          }
        }
      },
      "pipeline_component_costs": {
        "step_1_script_parsing": 0.0,
        "step_2_voice_generation": 0.0,
        "step_3_image_generation": 0.0,
        "step_4_cost_estimation": 0.0,
        "step_5_audio_processing": 0.0,
        "step_6_quality_assurance": 0.0,
        "step_7_video_assembly": 0.0,
        "step_8_distribution": 0.0
      },
      "cost_per_minute": 0.0
    },
    "timing_estimates": {
      "total_duration_seconds": 0.0,
      "total_duration_minutes": 0.0,
      "dialogue_duration_seconds": 0,
      "transition_duration_seconds": 0.0,
      "total_words": 0,
      "average_speech_rate_wpm": 150,
      "scene_count": 0,
      "scene_timings": []
    },
    "validation_status": "warning",
    "character_count_by_speaker": {}
  },
  "episode_metadata": {
    "title": "Episode 9 Example",
    "number": "episode_9_example",
    "input_file": "/Users/petergiordano/Documents/GitHub/vsmonster/reference/episode_9_example.md",
    "content_preview": "\n# **OWLBEAR VS. DISPLACER BEAST: FEATHERS, CLAWS, AND DISPLACEMENT**\n\n## **[SCENE: EPISODE METADATA]**\n\n**EPISODE METADATA**\n\n- Episode Title: Owlbear vs. Displacer Beast: Feathers, Claws, and Displa...",
    "total_scenes": 0
  },
  "scenes": [],
  "warnings": [
    "No scene markers found. Expected format: ## **[SCENE: NAME]**",
    "Required character 'ZARA' not found in any dialogue",
    "Required character 'THORAK' not found in any dialogue",
    "No AMBIENT: tags found in episode",
    "No SFX: tags found in episode",
    "No MUSIC: tags found in episode",
    "No TRANSITION: tags found in episode",
    "No IMG: tags found in episode",
    "No image tags found in any scene - visual content may be missing"
  ],
  "feedback": {
    "missing_tags": [
      "Character: ZARA",
      "Character: THORAK",
      "Multimedia: AMBIENT:",
      "Multimedia: SFX:",
      "Multimedia: MUSIC:",
      "Multimedia: TRANSITION:",
      "Multimedia: IMG:",
      "Images: No visual content"
    ],
    "format_violations": [
      "Missing scene structure"
    ],
    "quality_suggestions": [
      "Episode has only 0 dialogues - consider adding more content",
      "Episode has only 0 characters - may be too short for podcast format"
    ]
  }
}